{
  "case_id": "CASE_A_NONNORMAL_PSEUDOSUBSYSTEM",
  "module_id": "S18",
  "diagnostics_reported": [
    "block_residual_rho_res",
    "finite_horizon_gain_Gs",
    "state_space_leakage",
    "observable_space_leakage",
    "observable_closure_defect"
  ],
  "gate_outcomes": {
    "finite_horizon_control": "fail",
    "observable_closure": "fail_or_borderline"
  },
  "expected_final_verdict": "inconclusive",
  "actual_final_verdict": "inconclusive",
  "supported_forbidden": true,
  "supported_required": false,
  "notes": [
    "Finite-horizon and closure outputs are surfaced from the subsystem matrix.",
    "truth_family=Block upper triangular Liouville generator with slow block A, fast block F, and nontrivial coupling B"
  ]
}